<?xml version="1.0" encoding="utf-8"?>
<!--
   Licensed to the Apache Software Foundation (ASF) under one or more
   contributor license agreements.  See the NOTICE file distributed with
   this work for additional information regarding copyright ownership.
   The ASF licenses this file to You under the Apache License, Version 2.0
   (the "License"); you may not use this file except in compliance with
   the License.  You may obtain a copy of the License at

       https://www.apache.org/licenses/LICENSE-2.0

   Unless required by applicable law or agreed to in writing, software
   distributed under the License is distributed on an "AS IS" BASIS,
   WITHOUT WARRANTIES OR CONDITIONS OF ANY KIND, either express or implied.
   See the License for the specific language governing permissions and
   limitations under the License.
-->
<!DOCTYPE contributors
[
<!ELEMENT name (first?, middle?, last)>
<!ELEMENT contributors (introduction, name+)>
<!ELEMENT first (#PCDATA)>
<!ELEMENT introduction (#PCDATA)>
<!ELEMENT middle (#PCDATA)>
<!ELEMENT last (#PCDATA)>
]
>

<contributors>
  <introduction>
  These are some of the many people who have helped Ant become so successful.
  </introduction>
  <name>
    <first>Adam</first>
    <last>Blinkinsop</last>
  </name>
  <name>
    <first>Adam</first>
    <last>Bryzak</last>
  </name>
  <name>
    <first>Adam</first>
    <last>Murdoch</last>
  </name>
  <name>
    <first>Adam</first>
    <last>Retter</last>
  </name> 
  <name>
    <first>Adam</first>
    <last>Sotona</last>
  </name>
  <name>
    <first>Adrian</first>
    <last>Nistor</last>
  </name>
  <name>
    <first>Adrien</first>
    <last>Grand</last>
  </name>
  <name>
    <first>Aleksandr</first>
    <last>Ishutin</last>
  </name>
  <name>
    <first>Aleksei</first>
    <last>Zotov</last>
  </name>
  <name>
    <first>Alex</first>
    <last></last>
  </name>
  <name>
    <first>Alex</first>
    <last>Rosen</last>
  </name>
  <name>
    <first>Alexander</first>
    <last>Grund</last>
  </name>
  <name>
    <first>Alexei</first>
    <last>Yudichev</last>
  </name>
  <name>
    <first>Alexey</first>
    <last>Panchenko</last>
  </name>
  <name>
    <first>Alexey</first>
    <last>Solofnenko</last>
  </name>
  <name>
    <first>Alfred</first>
    <last>Theorin</last>
  </name>
  <name>
    <first>Alison</first>
    <last>Winters</last>
  </name>
  <name>
    <first>Andreas</first>
    <last>Ames</last>
  </name>
  <name>
    <first>Andreas</first>
    <last>Mross</last>
  </name>
  <name>
    <first>Andrew</first>
    <last>Eisenberg</last>
  </name>
  <name>
    <first>Andrew</first>
    <last>Everitt</last>
  </name>
  <name>
    <first>Andrew</first>
    <last>Stevens</last>
  </name>
  <name>
    <first>Andrey</first>
    <last>Urazov</last>
  </name>
  <name>
    <first>André-John</first>
    <last>Mas</last>
  </name>
  <name>
    <first>Andy</first>
    <last>Wood</last>
  </name>
  <name>
    <first>Anil</first>
    <middle>K.</middle>
    <last>Vijendran</last>
  </name>
  <name>
    <first>Anli</first>
    <last>Shundi</last>
  </name>
  <name>
    <first>Anthony</first>
    <last>Green</last>
  </name>
  <name>
    <first>Anthony</first>
    <last>Wat</last>
  </name>
  <name>
    <first>Antoine</first>
    <last>Baudoux</last>
  </name>
  <name>
    <first>Antoine</first>
    <last>Levy-Lambert</last>
  </name>
  <name>
    <first>Anton</first>
    <last>Mazkovoi</last>
  </name>
  <name>
    <first>Arcadius</first>
    <last>Ahouansou</last>
  </name>
  <name>
    <first>Arjan</first>
    <last>Veenstra</last>
  </name>
  <name>
    <first>Arnaud</first>
    <last>Vandyck</last>
  </name>
  <name>
    <first>Arnout</first>
    <middle>J.</middle>
    <last>Kuiper</last>
  </name>
  <name>
    <first>Arturo</first>
    <last>Bernal</last>
  </name>
  <name>
    <first>Arun</first>
    <last>Jamwal</last>
  </name>
  <name>
    <first>Aslak</first>
    <last>Hellesôy</last>
  </name>
  <name>
    <first>Atsuhiko</first>
    <last>Yamanaka</last>
  </name>
  <name>
    <first>Avik</first>
    <last>Sengupta</last>
  </name>
  <name>
    <first>Balazs</first>
    <last>Fejes 2</last>
  </name>
  <name>
    <last>barney2k7</last>
  </name>
  <name>
    <first>Bart</first>
    <last>Vanhaute</last>
  </name>
  <name>
    <first>Basil</first>
    <last>Crow</last>
  </name>
  <name>
    <first>Benjamin</first>
    <last>Burgess</last>
  </name>
  <name>
    <first>Ben</first>
    <last>Galbraith</last>
  </name>
  <name>
    <first>Ben</first>
    <last>Gertzfield</last>
  </name>
  <name>
    <first>Benoit</first>
    <last>Moussaud</last>
  </name>
  <name>
    <first>Bernd</first>
    <last>Dutkowski</last>
  </name>
  <name>
    <first>Bernhard</first>
    <last>Rosenkraenzer</last>
  </name>
  <name>
    <first>Björn</first>
    <last>Kautler</last>
  </name>
  <name>
    <first>Brad</first>
    <last>Clark</last>
  </name>
  <name>
    <first>Brant</first>
    <middle>Langer</middle>
    <last>Gurganus</last>
  </name>
  <name>
    <first>Brian</first>
    <last>Curnow</last>
  </name>
  <name>
    <first>Brian</first>
    <last>Deitte</last>
  </name>
  <name>
    <first>Brian</first>
    <last>Felder</last>
  </name>
  <name>
    <first>Brian</first>
    <last>Repko</last>
  </name>
  <name>
    <first>Bruce</first>
    <last>Atherton</last>
  </name>
  <name>
    <first>Cedomir</first>
    <last>Igaly</last>
  </name>
  <name>
    <first>Charles</first>
    <last>Duffy</last>
  </name>
  <name>
    <first>Charles</first>
    <last>Hudak</last>
  </name>
  <name>
    <first>Charlie</first>
    <last>Hubbard</last>
  </name>
  <name>
    <first>Chris</first>
    <last>Hegarty</last>
  </name>
  <name>
    <first>Chris</first>
    <last>Povirk</last>
  </name>
  <name>
    <first>Christian</first>
    <last>Knorr</last>
  </name>
  <name>
    <first>Christian</first>
    <last>Schmidt</last>
  </name>
  <name>
    <first>Christoph</first>
    <last>Dreis</last>
  </name>
  <name>
    <first>Christoph</first>
    <last>Gysin</last>
  </name>
  <name>
    <first>Christoph</first>
    <last>Wilhelms</last>
  </name>
  <name>
    <first>Christophe</first>
    <last>Labouisse</last>
  </name>
  <name>
    <first>Christopher</first>
    <middle>A.</middle>
    <last>Longo</last>
  </name>
  <name>
    <first>Christopher</first>
    <last>Charlier</last>
  </name>
  <name>
    <first>Clark</first>
    <last>Archer</last>
  </name>
  <name>
    <first>Clemens</first>
    <last>Hammacher</last>
  </name>
  <name>
    <first>Clement</first>
    <last>OUDOT</last>
  </name>
  <name>
    <first>Clive</first>
    <last>Brettingham-Moore</last>
  </name>
  <name>
    <first>Conor</first>
    <last>MacNeill</last>
  </name>
  <name>
    <first>Costin</first>
    <last>Manolache</last>
  </name>
  <name>
    <first>Craeg</first>
    <last>Strong</last>
  </name>
  <name>
    <first>Craig</first>
    <last>Cottingham</last>
  </name>
  <name>
    <first>Craig</first>
    <last>Pell</last>
  </name>
  <name>
    <first>Craig</first>
    <middle>R.</middle>
    <last>McClanahan</last>
  </name>
  <name>
    <first>Craig</first>
    <last>Richardson</last>
  </name>
  <name>
    <first>Craig</first>
    <last>Ryan</last>
  </name>
  <name>
    <first>Craig</first>
    <last>Sandvik</last>
  </name>
  <name>
    <first>Curt</first>
    <last>Arnold</last>
  </name>
  <name>
    <first>Curtis</first>
    <last>White</last>
  </name>
  <name>
    <first>Cyrille</first>
    <last>Morvan</last>
  </name>
  <name>
    <first>D'Arcy</first>
    <last>Smith</last>
  </name>
  <name>
    <first>Dale</first>
    <last>Anson</last>
  </name>
  <name>
    <first>Dale</first>
    <last>Sherwood</last>
  </name>
  <name>
    <first>Dan</first>
    <last>Armbrust</last>
  </name>
  <name>
    <first>Dana</first>
    <last>Dahlstrom</last>
  </name>
  <name>
    <first>Daniel</first>
    <last>Henrique</last>
  </name>
  <name>
    <first>Daniel</first>
    <last>Ribagnac</last>
  </name>
  <name>
    <first>Daniel</first>
    <last>Spilker</last>
  </name>
  <name>
    <first>Daniel</first>
    <last>Trebbien</last>
  </name>
  <name>
    <first>Danno</first>
    <last>Ferrin</last>
  </name>
  <name>
    <first>Danny</first>
    <last>Yates</last>
  </name>
  <name>
    <first>Dante</first>
    <last>Briones</last>
  </name>
  <name>
    <first>Darrell</first>
    <last>DeBoer</last>
  </name>
  <name>
    <first>Davanum</first>
    <last>Srinivas</last>
  </name>
  <name>
    <first>Dave</first>
    <last>Brondsema</last>
  </name>
  <name>
    <first>Dave</first>
    <last>Brosius</last>
  </name>
  <name>
    <first>David</first>
    <middle>A.</middle>
    <last>Herman</last>
  </name>
  <name>
    <first>David</first>
    <last>Crossley</last>
  </name>
  <name>
    <first>David</first>
    <last>Gärtner</last>
  </name>
  <name>
    <first>David</first>
    <middle>S.</middle>
    <last>Johnson</last>
  </name>
  <name>
    <first>David</first>
    <last>Kavanagh</last>
  </name>
  <name>
    <first>David</first>
    <last>LeRoy</last>
  </name>
  <name>
    <first>David</first>
    <last>Leal</last>
  </name>
  <name>
    <first>David</first>
    <middle>M.</middle>
    <last>Lloyd</last>
  </name>
  <name>
    <first>David</first>
    <last>Maclean</last>
  </name>
  <name>
    <first>David</first>
    <last>Rees</last>
  </name>
  <name>
    <first>Denis</first>
    <last>Hennessy</last>
  </name>
  <name>
    <first>Derek</first>
    <last>Slager</last>
  </name>
  <name>
    <first>Devon</first>
    <middle>C.</middle>
    <last>Miller</last>
  </name>
  <name>
    <first>Diane</first>
    <last>Holt</last>
  </name>
  <name>
    <first>dIon</first>
    <last>Gillard</last>
  </name>
  <name>
    <first>Dmitry</first>
    <middle>A.</middle>
    <last>Kuminov</last>
  </name>
  <name>
    <first>Dominique</first>
    <last>Devienne</last>
  </name>
  <name>
    <first>Don</first>
    <last>Brown</last>
  </name>
  <name>
    <first>Don</first>
    <last>Ferguson</last>
  </name>
  <name>
    <first>Don</first>
    <last>Jeffery</last>
  </name>
  <name>
    <first>Donal</first>
    <last>Quinlan</last>
  </name>
  <name>
    <first>Donald</first>
    <last>Leslie</last>
  </name>
  <name>
    <first>Drew</first>
    <last>Sudell</last>
  </name>
  <name>
    <first>Earl</first>
    <last>Hood</last>
  </name>
  <name>
    <first>Edison</first>
    <last>Guo</last>
  </name>
  <name>
    <first>Eduard</first>
    <last>Wirch</last>
  </name>
  <name>
    <first>Edwin</first>
    <last>Woudt</last>
  </name>
  <name>
    <first>Eli</first>
    <last>Tucker</last>
  </name>
  <name>
    <first>Emmanuel</first>
    <last>Bourg</last>
  </name>
  <name>
    <first>Eugène</first>
    <last>Adell</last>
  </name>
  <name>
    <first>Eric</first>
    <last>Delaunay</last>
  </name>
  <name>
    <first>Eric</first>
    <last>Olsen</last>
  </name>
  <name>
    <first>Eric</first>
    <last>Pugh</last>
  </name>
  <name>
    <first>Erik</first>
    <last>Costlow</last>
  </name>
  <name>
    <first>Erik</first>
    <last>Hatcher</last>
  </name>
  <name>
    <first>Erik</first>
    <last>Langenbach</last>
  </name>
  <name>
    <first>Erik</first>
    <last>Meade</last>
  </name>
  <name>
    <first>Ernst</first>
    <last>de Haan</last>
  </name>
  <name>
    <first>Evan</first>
    <last>Saulpaugh</last>
  </name>
  <name>
    <first>Francesco</first>
    <last>Steccanella</last>
  </name>
  <name>
    <first>Frank</first>
    <last>Harnack</last>
  </name>
  <name>
    <first>Frank</first>
    <last>Somers</last>
  </name>
  <name>
    <first>Frank</first>
    <last>Zeyda</last>
  </name>
  <name>
    <first>František</first>
    <last>Kučera</last>
  </name>
  <name>
    <first>Frédéric</first>
    <last>Bothamy</last>
  </name>
  <name>
    <first>Frederic</first>
    <last>Lavigne</last>
  </name>
  <name>
    <first>Gal</first>
    <last>Shachor</last>
  </name>
  <name>
    <first>Gary</first>
    <middle>S.</middle>
    <last>Weaver</last>
  </name>
  <name>
    <first>Gautam</first>
    <last>Guliani</last>
  </name>
  <name>
    <first>Gene-Sung</first>
    <last>Chung</last>
  </name>
  <name>
    <first>George</first>
    <last>Bateman</last>
  </name>
  <name>
    <first>Georges-Etienne</first>
    <last>Legendre</last>
  </name>
  <name>
    <first>Gero</first>
    <last>Vermaas</last>
  </name>
  <name>
    <first>Gerrit</first>
    <last>Riessen</last>
  </name>
  <name>
    <first>Gilbert</first>
    <last>Rebhan</last>
  </name>
  <name>
    <first>Gilles</first>
    <last>Querret</last>
  </name>
  <name>
    <first>Gilles</first>
    <last>Scokart</last>
  </name>
  <name>
    <first>Glenn</first>
    <last>McAllister</last>
  </name>
  <name>
    <first>Glenn</first>
    <last>Twiggs</last>
  </name>
  <name>
    <first>Gösen</first>
    <last></last>
  </name>
  <name>
    <first>Greg</first>
    <last>Nelson</last>
  </name>
  <name>
    <first>Greg</first>
    <last>Roodt</last>
  </name>
  <name>
    <first>Greg</first>
    <last>Schueler</last>
  </name>
  <name>
    <first>Grégoire</first>
    <last>Vatry</last>
  </name>
  <name>
    <first>Günther</first>
    <last>Kögel</last>
  </name>
  <name>
    <first>Hannes</first>
    <last>Wellmann</last>
  </name>
  <name>
    <first>Harish</first>
    <last>Prabandham</last>
  </name>
  <name>
    <first>Haroon</first>
    <last>Rafique</last>
  </name>
  <name>
    <first>Helder</first>
    <last>Pereira</last>
  </name>
  <name>
    <first>Hiroaki</first>
    <last>Nakamura</last>
  </name>
  <name>
    <first>Holger</first>
    <last>Engels</last>
  </name>
  <name>
    <first>Holger</first>
    <last>Joest</last>
  </name>
  <name>
    <first>Ignacio</first>
    <last>Coloma</last>
  </name>
  <name>
    <first>Ingenonsya</first>
    <last>France</last>
  </name>
  <name>
    <first>Ingmar</first>
    <last>Stein</last>
  </name>
  <name>
    <first>Irene</first>
    <last>Rusman</last>
  </name>
  <name>
    <first>Isaac</first>
    <last>Shabtay</last>
  </name>
  <name>
    <first>Issa</first>
    <last>Gorissen</last>
  </name>
  <name>
    <first>Ivan</first>
    <last>Ivanov</last>
  </name>
  <name>
    <first>J</first>
    <last>Bleijenbergh</last>
  </name>
  <name>
    <first>JC</first>
    <last>Mann</last>
  </name>
  <name>
    <first>Jack</first>
    <middle>J.</middle>
    <last>Woehr</last>
  </name>
  <name>
    <first>Jacobus</first>
    <middle>Martinus</middle>
    <last>Kruithof</last>
  </name>
  <name>
    <first>Jaikiran</first>
    <last>Pai</last>
  </name>  
  <name>
    <first>James</first>
    <middle>Duncan</middle>
    <last>Davidson</last>
  </name>
  <name>
    <first>James</first>
    <last>Todd</last>
  </name>
  <name>
    <first>Jan</first>
    <last>Cumps</last>
  </name>
  <name>
    <first>Jan</first>
    <last>Matèrne</last>
  </name>
  <name>
    <first>Jan</first>
    <last>Mynarik</last>
  </name>
  <name>
    <first>Jan</first>
    <last>Stolze</last>
  </name>
  <name>
    <first>Jason</first>
    <last>Hunter</last>
  </name>
  <name>
    <first>Jason</first>
    <last>Pettiss</last>
  </name>
  <name>
    <first>Jason</first>
    <last>Salter</last>
  </name>
  <name>
    <first>Jason</first>
    <last>Yip</last>
  </name>
  <name>
    <first>Jay</first>
    <middle>Dickon</middle>
    <last>Glanville</last>
  </name>
  <name>
    <first>Jay</first>
    <last>Peck</last>
  </name>
  <name>
    <first>Jay</first>
    <last>van der Meer</last>
  </name>
  <name>
    <first>Jean-Francois</first>
    <last>Brousseau</last>
  </name>
  <name>
    <first>Jean-Louis</first>
    <last>Boudart</last>
  </name>
  <name>
    <first>Jeff</first>
    <last>Gettle</last>
  </name>
  <name>
    <first>Jeff</first>
    <last>Martin</last>
  </name>
  <name>
    <first>Jeff</first>
    <last>Tulley</last>
  </name>
  <name>
    <first>Jeff</first>
    <last>Turner</last>
  </name>
  <name>
    <first>Jeffrey</first>
    <last>Adamson</last>
  </name>
  <name>
    <first>Jene</first>
    <last>Jasper</last>
  </name>
  <name>
    <first>Jeremy</first>
    <last>Mawson</last>
  </name>
  <name>
    <first>Jerome</first>
    <last>Lacoste</last>
  </name>
  <name>
    <first>Jesse</first>
    <last>Glick</last>
  </name>
  <name>
    <first>Jesse</first>
    <last>Stockall</last>
  </name>
  <name>
    <first>Jim</first>
    <last>Allers</last>
  </name>
  <name>
    <first>Jimmy</first>
    <last>Casey</last>
  </name>
  <name>
    <first>Joel</first>
    <last>Tucci</last>
  </name>
  <name>
    <first>Joerg</first>
    <last>Michelberger</last>
  </name>
  <name>
    <first>Joerg</first>
    <last>Wassmer</last>
  </name>
  <name>
    <first>Joey</first>
    <last>Richey</last>
  </name>
  <name>
    <first>Johann</first>
    <last>Herunter</last>
  </name>
  <name>
    <first>John</first>
    <last>Elion</last>
  </name>
  <name>
    <first>John</first>
    <last>Sisson</last>
  </name>
  <name>
    <first>Jon</first>
    <last>Dickinson</last>
  </name>
  <name>
    <first>Jon</first>
    <last>Skeet</last>
  </name>
  <name>
    <first>Jon</first>
    <middle>S.</middle>
    <last>Stevens</last>
  </name>
  <name>
    <first>Jonathan</first>
    <middle>K.</middle>
    <last>Schneider</last>
  </name>
  <name>
    <first>Jose</first>
    <middle>Alberto</middle>
    <last>Fernandez</last>
  </name>
  <name>
    <first>Joseph</first>
    <last>Walton</last>
  </name>
  <name>
    <first>Josh</first>
    <last>Lucas</last>
  </name>
  <name>
    <first>Josh</first>
    <last>Martín-Jaffe</last>
  </name>
  <name>
    <first>Juerg</first>
    <last>Wanner</last>
  </name>
  <name>
    <first>Julian</first>
    <last>Simpson</last>
  </name>
  <name>
    <first>Julien</first>
    <last>Lepiller</last>
  </name>
  <name>
    <first>Justin</first>
    <last>Vallon</last>
  </name>
  <name>
    <first>Justyna</first>
    <last>Horwat</last>
  </name>
  <name>
    <first>Karl</first>
    <last>Jansen</last>
  </name>
  <name>
    <first>Keiron</first>
    <last>Liddle</last>
  </name>
  <name>
    <first>Keith</first>
    <last>Visco</last>
  </name>
  <name>
    <first>Keith</first>
    <middle>W.</middle>
    <last>Campbell</last>
  </name>
  <name>
    <first>Kevin</first>
    <middle>Connor</middle>
    <last>Arpe</last>
  </name>
  <name>
    <first>Kevin</first>
    <last>Greiner</last>
  </name>
  <name>
    <first>Kevin</first>
    <last>Jackson</last>
  </name>
  <name>
    <first>Kevin</first>
    <last>Ross</last>
  </name>
  <name>
    <first>Kevin</first>
    <middle>Z.</middle>
    <last>Grey</last>
  </name>
  <name>
    <first>Kien</first>
    <last>Dang</last>
  </name>
  <name>
    <first>Kim</first>
    <last>Hansen</last>
  </name>
  <name>
    <first>Kirk</first>
    <last>Wylie</last>
  </name>
  <name>
    <first>Kristian</first>
    <last>Rosenvold</last>
  </name>
  <name>
    <first>Kui</first>
    <last>Liu</last>
  </name>
  <name>
    <first>Kyle</first>
    <last>Adams</last>
  </name>
  <name>
    <first>Lajos</first>
    <last>Veres</last>
  </name>
  <name>
    <first>Larry</first>
    <last>Shatzer</last>
  </name>
  <name>
    <first>Larry</first>
    <last>Streepy</last>
  </name>
  <name>
    <first>Les</first>
    <last>Hughes</last>
  </name>
  <name>
    <first>Levi</first>
    <last>Cook</last>
  </name>
  <name>
    <last>lucas</last>
  </name>
  <name>
    <first>Lucas</first>
    <last>Werkmeister</last>
  </name>
  <name>
    <first>Ludovic</first>
    <last>Claude</last>
  </name>
  <name>
    <first>Maarten</first>
    <last>Coene</last>
  </name>
  <name>
    <first>Magesh</first>
    <last>Umasankar</last>
  </name>
  <name>
    <first>Maneesh</first>
    <last>Sahu</last>
  </name>
  <name>
    <first>Marc</first>
    <last>Guillemot</last>
  </name>
  <name>
    <first>Marc</first>
    <last>Strapetz</last>
  </name>
  <name>
    <first>Marcel</first>
    <last>Schutte</last>
  </name>
  <name>
    <first>Marcus</first>
    <last>Börger</last>
  </name>
  <name>
    <first>Mario</first>
    <last>Frasca</last>
  </name>
  <name>
    <first>Mariusz</first>
    <last>Nowostawski</last>
  </name>
  <name>
    <first>Mark</first>
    <middle>A.</middle>
    <last>Ziesemer</last>
  </name>
  <name>
    <first>Mark</first>
    <last>DeLaFranier</last>
  </name>
  <name>
    <first>Mark</first>
    <last>Harmer</last>
  </name>
  <name>
    <first>Mark</first>
    <last>Hecker</last>
  </name>
  <name>
    <first>Mark</first>
    <last>Niggemann</last>
  </name>
  <name>
    <first>Mark</first>
    <middle>R.</middle>
    <last>Diggory</last>
  </name>
  <name>
    <first>Mark</first>
    <last>Salter</last>
  </name>
  <name>
    <first>Markus</first>
    <last>Kahl</last>
  </name>
  <name>
    <first>Martijn</first>
    <last>Kruithof</last>
  </name>
  <name>
    <first>Martin</first>
    <last>Landers</last>
  </name>
  <name>
    <first>Martin</first>
    <last>Poeschl</last>
  </name>
  <name>
    <first>Martin</first>
    <last>van den Bemt</last>
  </name>
  <name>
    <first>Martin</first>
    <last>von Gagern</last>
  </name>
  <name>
    <first>Mateusz</first>
    <last>Kazimierczuk</last>
  </name>
  <name>
    <first>Mathieu</first>
    <last>Champlon</last>
  </name>
  <name>
    <first>Mathieu</first>
    <last>Peltier</last>
  </name>
  <name>
    <first>Matt</first>
    <last>Albrecht</last>
  </name>
  <name>
    <first>Matt</first>
    <last>Benson</last>
  </name>
  <name>
    <first>Matt</first>
    <last>Bishop</last>
  </name>
  <name>
    <first>Matt</first>
    <last>Foemmel</last>
  </name>
  <name>
    <first>Matt</first>
    <last>Grosso</last>
  </name>
  <name>
    <first>Matt</first>
    <last>Humphrey</last>
  </name>
  <name>
    <first>Matt</first>
    <last>Small</last>
  </name>
  <name>
    <first>Matt</first>
    <last>Wildig</last>
  </name>
  <name>
    <first>Matthew</first>
    <last>Hawthorne</last>
  </name>
  <name>
    <first>Matthew</first>
    <last>Inger</last>
  </name>
  <name>
    <first>Matthew</first>
    <middle>Kuperus</middle>
    <last>Heun</last>
  </name>
  <name>
    <first>Matthew</first>
    <last>Warman</last>
  </name>
  <name>
    <first>Matthew</first>
    <last>Watson</last>
  </name>
  <name>
    <first>Matthew</first>
    <last>Yanos</last>
  </name>
  <name>
    <first>Matthias</first>
    <last>Bhend</last>
  </name>
  <name>
    <first>Matthias</first>
    <last>Gutheil</last>
  </name>
  <name>
    <first>Matthias</first>
    <middle>Johann</middle>
    <last>Vill</last>
  </name>
  <name>
    <first>Michael</first>
    <last>Bayne</last>
  </name>
  <name>
    <first>Michael</first>
    <last>Clarke</last>
  </name>
  <name>
    <first>Michael</first>
    <last>Davey</last>
  </name>
  <name>
    <first>Michael</first>
    <middle>J.</middle>
    <last>Sikorsky</last>
  </name>
  <name>
    <first>Michael</first>
    <last>McCallum</last>
  </name>
  <name>
    <first>Michael</first>
    <last>Montuori</last>
  </name>
  <name>
    <first>Michael</first>
    <last>Newcomb</last>
  </name>
  <name>
    <first>Michael</first>
    <last>Nygard</last>
  </name>
  <name>
    <first>Michael</first>
    <last>Saunders</last>
  </name>
  <name>
    <first>Michael</first>
    <last>Seele</last>
  </name>
  <name>
    <first>Mickaël</first>
    <last>Guessant</last>
  </name>
  <name>
    <last>Miha</last>
  </name>
  <name>
    <first>Mike</first>
    <last>Davis</last>
  </name>
  <name>
    <first>Mike</first>
    <last>Roberts</last>
  </name>
  <name>
    <first>Mike</first>
    <last>Williams</last>
  </name>
  <name>
    <first>Mikolaj</first>
    <last>Izdebski</last>
  </name>
  <name>
    <first>Miroslav</first>
    <last>Zaťko</last>
  </name>
  <name>
    <first>Mounir</first>
    <last>El Hajj</last>
  </name>
  <name>
    <first>Nathan</first>
    <last>Beyer</last>
  </name>
  <name>
    <first>Nick</first>
    <last>Chalko</last>
  </name>
  <name>
    <first>Nick</first>
    <last>Crossley</last>
  </name>
  <name>
    <first>Nick</first>
    <last>Davis</last>
  </name>
  <name>
    <first>Nick</first>
    <last>Fortescue</last>
  </name>
  <name>
    <first>Nick</first>
    <last>King</last>
  </name>
  <name>
    <first>Nick</first>
    <last>Pellow</last>
  </name>
  <name>
    <first>Nico</first>
    <last>Seessle</last>
  </name>
  <name>
    <first>Nicola</first>
    <middle>Ken</middle>
    <last>Barozzi</last>
  </name>
  <name>
    <first>Nicolas</first>
    <last>Lalevée</last>
  </name>
  <name>
    <first>Nigel</first>
    <last>Magnay</last>
  </name>
  <name>
    <first>Oliver</first>
    <last>Merkel</last>
  </name>
  <name>
    <first>Oliver</first>
    <last>Rossmueller</last>
  </name>
  <name>
    <first>Olivier</first>
    <last>Parent</last>
  </name>
  <name>
    <first>Omer</first>
    <last>Shapira</last>
  </name>
  <name>
    <first>Ondra</first>
    <last>Medek</last>
  </name>
  <name>
    <first>Patrick</first>
    <last>Altaie</last>
  </name>
  <name>
    <first>Patrick</first>
    <middle>C.</middle>
    <last>Beard</last>
  </name>
  <name>
    <first>Patrick</first>
    <last>Chanezon</last>
  </name>
  <name>
    <first>Patrick</first>
    <middle>Gus</middle>
    <last>Heck</last>
  </name>
  <name>
    <first>Patrick</first>
    <last>Martin</last>
  </name>
  <name>
    <first>Paul</first>
    <last>Austin</last>
  </name>
  <name>
    <first>Paul</first>
    <last>Christmann</last>
  </name>
  <name>
    <first>Paul</first>
    <last>Galbraith</last>
  </name>
  <name>
    <first>Paul</first>
    <last>King</last>
  </name>
  <name>
    <first>Paulo</first>
    <last>Gaspar</last>
  </name>
  <name>
    <first>Pavan</first>
    <last>Bayyapu</last>
  </name>
  <name>
    <first>Pavel</first>
    <last>Jisl</last>
  </name>
  <name>
    <first>Paweł</first>
    <last>Zuzelski</last>
  </name>
  <name>
    <first>Peter</first>
    <middle>B.</middle>
    <last>West</last>
  </name>
  <name>
    <first>Peter</first>
    <last>Donald</last>
  </name>
  <name>
    <first>Peter</first>
    <last>Doornbosch</last>
  </name>
  <name>
    <first>Peter</first>
    <last>Hulst</last>
  </name>
  <name>
    <first>Peter</first>
    <last>Janes</last>
  </name>
  <name>
    <first>Peter</first>
    <last>Reilly</last>
  </name>
  <name>
    <first>Petr</first>
    <last>Kureš</last>
  </name>
  <name>
    <first>Phil</first>
    <last>Hanna</last>
  </name>
  <name>
    <first>Philip</first>
    <last>Hourihane</last>
  </name>
  <name>
    <first>Phillip</first>
    <last>Wells</last>
  </name>
  <name>
    <first>Pierre</first>
    <last>Delisle</last>
  </name>
  <name>
    <first>Pierre</first>
    <last>Dittgen</last>
  </name>
  <name>
    <first>Piotr</first>
    <middle>P.</middle>
    <last>Karwasz</last>
  <name>
    <first>Preston</first>
    <last>Bannister</last>
  </name>
  <name>
    <first>Ralf</first>
    <last>Hergert</last>
  </name>
  <name>
    <first>Rami</first>
    <last>Ojares</last>
  </name>
  <name>
    <first>Randy</first>
    <last>Watler</last>
  </name>
  <name>
    <first>Raphael</first>
    <last>Pierquin</last>
  </name>
  <name>
    <first>Ray</first>
    <last>Waldin</last>
  </name>
  <name>
    <first>Razzi</first>
    <last>Abuissa</last>
  </name>
  <name>
    <first>Reinhard</first>
    <last>Pointner</last>
  </name>
  <name>
    <first>Remie</first>
    <last>Bolte</last>
  </name>
  <name>
    <first>René</first>
    <last>Krell</last>
  </name>
  <name>
    <first>Reudismam</first>
    <last>Rolim</last>
  </name>
  <name>
    <first>Richard</first>
    <last>Evans</last>
  </name>
  <name>
    <first>Richard</first>
    <last>Steele</last>
  </name>
  <name>
    <first>Rick</first>
    <last>Beton</last>
  </name>
  <name>
    <first>Rob</first>
    <last>Riasol</last>
  </name>
  <name>
    <first>Rob</first>
    <last>Oxspring</last>
  </name>
  <name>
    <first>Rob</first>
    <last>van Oostrum</last>
  </name>
  <name>
    <first>Robbie</first>
    <last>Gibson</last>
  </name>
  <name>
    <first>Robert</first>
    <middle>H.</middle>
    <last>Anderson</last>
  </name>
  <name>
    <first>Robert</first>
    <last>Clark</last>
  </name>
  <name>
    <first>Robert</first>
    <last>Flaherty</last>
  </name>
  <name>
    <first>Robert</first>
    <last>Shaw</last>
  </name>
  <name>
    <first>Robert</first>
    <last>Streich</last>
  </name>
  <name>
    <first>Robert</first>
    <last>Watkins</last>
  </name>
  <name>
    <first>Roberto</first>
    <last>Scaramuzzi</last>
  </name>
  <name>
    <first>Robin</first>
    <last>Green</last>
  </name>
  <name>
    <first>Robin</first>
    <last>Power</last>
  </name>
  <name>
    <first>Robin</first>
    <last>Verduijn</last>
  </name>
  <name>
    <first>Rodrigo</first>
    <last>Schmidt</last>
  </name>
  <name>
    <first>Roger</first>
    <last>Vaughn</last>
  </name>
  <name>
    <first>Roman</first>
    <last>Ivashin</last>
  </name>
  <name>
    <first>Roman</first>
    <last>Savko</last>
  </name>
  <name>
    <first>Ronen</first>
    <last>Mashal</last>
  </name>
  <name>
    <first>Russell</first>
    <last>Gold</last>
  </name>
  <name>
    <first>Ryan</first>
    <last>Bennitt</last>
  </name>
  <name>
    <first>Sam</first>
    <last>Ruby</last>
  </name>
  <name>
    <first>Sandra</first>
    <last>Metz</last>
  </name>
  <name>
    <first>Santosh</first>
    <middle>R.</middle>
    <last>Dhariwal</last>
  </name>
  <name>
    <first>Scott</first>
    <last>Carlson</last>
  </name>
  <name>
    <first>Scott</first>
    <last>Ellsworth</last>
  </name>
  <name>
    <first>Scott</first>
    <last>Johnson</last>
  </name>
  <name>
    <first>Scott</first>
    <middle>M.</middle>
    <last>Stirling</last>
  </name>
  <name>
    <first>Sean</first>
    <last>Egan</last>
  </name>
  <name>
    <first>Sean</first>
    <middle>P.</middle>
    <last>Kane</last>
  </name>
  <name>